{
  "name": "C_0805_2012Metric",
  "description": "Capacitor SMD 0805 (2012 Metric)",
  "package_type": "chip",
  "pin_count": 2,
  "body_length": {
    "min": 1.8,
    "max": 2.2
  },
  "body_width": {
    "min": 1.05,
    "max": 1.45
  },
  "terminal_length": {
    "min": 0.25,
    "max": 0.55
  },
  "density": "B",
  "source": {
    "drawing": "KiCad footprint generator size definitions (gitlab.com/kicad/libraries/kicad-footprint-generator, data/SMD_2terminal_chip_molded)"
  }
}
