{
  "name": "C_0402_1005Metric",
  "description": "Capacitor SMD 0402 (1005 Metric)",
  "package_type": "chip",
  "pin_count": 2,
  "body_length": {
    "nom": 1.0,
    "tol": 0.05
  },
  "body_width": {
    "nom": 0.5,
    "tol": 0.05
  },
  "terminal_length": {
    "nom": 0.25,
    "tol": 0.1
  },
  "density": "B",
  "source": {
    "drawing": "typical JEDEC/datasheet outline - check against your part's datasheet"
  }
}
