{
  "name": "SOIC-16_3.9x9.9mm_P1.27mm",
  "description": "SOIC-16 150 mil, JEDEC MS-012AC (e.g. CH340C SOP-16)",
  "package_type": "gullwing",
  "pin_count": 16,
  "pitch": 1.27,
  "lead_span": {
    "min": 5.8,
    "max": 6.2
  },
  "body_width": {
    "min": 3.8,
    "max": 4.0
  },
  "body_length": {
    "min": 9.8,
    "max": 10.0
  },
  "terminal_length": {
    "min": 0.4,
    "max": 1.27
  },
  "terminal_width": {
    "min": 0.31,
    "max": 0.51
  },
  "height_max": 1.75,
  "density": "B",
  "source": {
    "drawing": "JEDEC MS-012 variation AC"
  }
}
