{
  "name": "QFN-32-1EP_5x5mm_P0.5mm_EP3.45x3.45mm",
  "description": "QFN-32 5x5 mm, 0.5 mm pitch, exposed pad (LTC 05-08-1693 style)",
  "package_type": "qfn",
  "pin_count": 32,
  "pitch": 0.5,
  "body_length": {
    "min": 4.9,
    "max": 5.1
  },
  "body_width": {
    "min": 4.9,
    "max": 5.1
  },
  "terminal_length": {
    "min": 0.3,
    "max": 0.5
  },
  "terminal_width": {
    "min": 0.18,
    "max": 0.3
  },
  "exposed_pad": {
    "length": {
      "nom": 3.45
    },
    "width": {
      "nom": 3.45
    },
    "paste_coverage": 0.6
  },
  "height_max": 0.8,
  "density": "B",
  "source": {
    "datasheet": "http://www.analog.com/media/en/package-pcb-resources/package/pkg_pdf/ltc-legacy-qfn/QFN_32_05-08-1693.pdf"
  }
}
