{
  "name": "SOIC-8_3.9x4.9mm_P1.27mm",
  "description": "SOIC-8 150 mil, JEDEC MS-012AA",
  "package_type": "gullwing",
  "pin_count": 8,
  "pitch": 1.27,
  "lead_span": {
    "nom": 6.0,
    "tol": 0.2
  },
  "body_width": {
    "nom": 3.9,
    "tol": 0.1
  },
  "body_length": {
    "min": 4.8,
    "max": 5.0
  },
  "terminal_width": {
    "min": 0.31,
    "max": 0.51
  },
  "terminal_length": {
    "min": 0.4,
    "max": 1.27
  },
  "height_max": 1.75,
  "density": "B",
  "source": {
    "drawing": "KiCad footprint generator size definitions (gitlab.com/kicad/libraries/kicad-footprint-generator, data/package/gullwing/soic.yaml, JEDEC MS-012AA)"
  }
}
